{
  "$schema": "https://json-schema.org/draft/2020-12/schema",
  "$id": "https://harrow.haus/quoin/schema/pack.json",
  "title": "Quoin Pack Manifest",
  "type": "object",
  "required": ["name", "version", "type", "quoinVersion", "description", "exports"],
  "properties": {
    "$schema": { "type": "string" },
    "name": {
      "type": "string",
      "pattern": "^@[a-z0-9][a-z0-9-]*/[a-z][a-z0-9-]{1,31}$"
    },
    "version": {
      "type": "string",
      "pattern": "^\\d+\\.\\d+\\.\\d+(?:-[0-9A-Za-z.-]+)?(?:\\+[0-9A-Za-z.-]+)?$"
    },
    "type": { "enum": ["token", "vocabulary", "implementation"] },
    "quoinVersion": { "type": "string" },
    "description": { "type": "string", "minLength": 1, "maxLength": 200 },
    "exports": {
      "type": "object",
      "minProperties": 1,
      "additionalProperties": { "type": "string" }
    },
    "metadata": {
      "type": "object",
      "properties": {
        "author": { "type": "string" },
        "license": { "type": "string" },
        "homepage": { "type": "string" },
        "tags": { "type": "array", "items": { "type": "string" } }
      },
      "additionalProperties": false
    },
    "attribution": {
      "type": "object",
      "required": ["sourceSystem", "sourceLicense", "harvestedAt"],
      "properties": {
        "sourceSystem": { "type": "string" },
        "sourceOrganization": { "type": "string" },
        "sourceUrl": { "type": "string" },
        "sourceCommit": { "type": "string", "description": "Git SHA, tag, or branch of the upstream source at extraction time. Added in Phase 3.5." },
        "sourceLicense": { "type": "string" },
        "harvestedAt": { "type": "string" },
        "harvestNotes": { "type": "string" },
        "fidelityTier": { "type": "string", "enum": ["A", "B", "C"], "description": "Phase 3.5 fidelity classification: A = byte-faithful extraction; B = extracted with mapping notes; C = extraction failed, designed-interpretation values stand." }
      },
      "additionalProperties": false
    },
    "peerPacks": {
      "type": "object",
      "additionalProperties": { "type": "string" }
    },
    "capabilities": {
      "type": "array",
      "items": { "type": "string" }
    },
    "status": {
      "type": "string",
      "enum": ["pending-3.5c-fill"],
      "description": "Phase 0.5 transitional status. Packs marked 'pending-3.5c-fill' emit validation warnings instead of errors for missing canonical tokens. Removed after Phase 3.5c populates the expanded namespace."
    }
  },
  "allOf": [
    {
      "if": { "properties": { "type": { "const": "token" } } },
      "then": {
        "properties": {
          "exports": {
            "required": ["tokens"],
            "properties": { "tokens": { "type": "string" } }
          }
        }
      }
    },
    {
      "if": { "properties": { "type": { "const": "vocabulary" } } },
      "then": {
        "properties": {
          "exports": {
            "required": ["primitives"],
            "properties": {
              "primitives": { "type": "string" },
              "componentTokens": { "type": "string" }
            }
          }
        }
      }
    },
    {
      "if": { "properties": { "type": { "const": "implementation" } } },
      "then": {
        "properties": {
          "exports": {
            "required": ["emit", "metadata"],
            "properties": {
              "emit": { "type": "string" },
              "metadata": { "type": "string" }
            }
          }
        }
      }
    }
  ],
  "additionalProperties": false
}
