{
  "$schema": "https://harrow.haus/quoin/schema/pack.json",
  "name": "@quoin/vocab-editorial",
  "version": "0.1.0",
  "type": "vocabulary",
  "quoinVersion": "^0.1.0",
  "description": "Editorial, layout, and content primitives (Phase 1 fixture).",
  "exports": {
    "primitives": "./primitives/index.json"
  },
  "metadata": {
    "author": "Quoin",
    "license": "MIT",
    "tags": ["editorial", "long-form", "content"]
  }
}
