{
  "$schema": "https://harrow.haus/quoin/schema/pack.json",
  "name": "@quoin/tokens-chakra",
  "version": "0.1.0",
  "type": "token",
  "quoinVersion": "^0.1.0",
  "description": "Chakra UI default palette translated onto the Quoin canonical semantic-token namespace.",
  "exports": {
    "tokens": "./tokens/index.json",
    "css": "./tokens.css"
  },
  "metadata": {
    "author": "Quoin",
    "license": "MIT",
    "homepage": "https://harrow.haus/quoin/packs/tokens-chakra",
    "tags": [
      "chakra",
      "teal-accent",
      "react"
    ]
  },
  "attribution": {
    "sourceSystem": "Chakra UI",
    "sourceOrganization": "Chakra UI community",
    "sourceUrl": "https://raw.githubusercontent.com/chakra-ui/chakra-ui/main/packages/react/src/theme/tokens/colors.ts",
    "sourceLicense": "MIT",
    "harvestedAt": "2026-05-17",
    "harvestNotes": "Chakra UI v3 colour tokens extracted from packages/react/src/theme/tokens/colors.ts. Chakra wraps every value in `{ value: '#hex' }` per the Panda-CSS / @chakra-ui/styled-system convention. The value-wrapped-ts parser handles this shape. Extraction method: A. Mapping: Chakra v3 50-950 ramps for gray/red/orange/yellow/green/teal/blue/cyan/purple/pink. Default accent = teal.500 per Chakra convention. whiteAlpha/blackAlpha (semi-transparent overlays) are not modelled in the base palette — Quoin's primitives handle overlay tints via the impl pack.",
    "fidelityTier": "B",
    "sourceCommit": "main"
  },
  "status": "pending-3.5c-fill"
}
