{
  "$schema": "https://harrow.haus/quoin/schema/pack.json",
  "name": "@quoin/tokens-bulma",
  "version": "0.1.0",
  "type": "token",
  "quoinVersion": "^0.1.0",
  "description": "Bulma CSS framework default palette translated onto the Quoin canonical semantic-token namespace.",
  "exports": {
    "tokens": "./tokens/index.json",
    "css": "./tokens.css"
  },
  "metadata": {
    "author": "Quoin",
    "license": "MIT",
    "homepage": "https://harrow.haus/quoin/packs/tokens-bulma",
    "tags": [
      "bulma",
      "turquoise-accent",
      "css-only",
      "sass"
    ]
  },
  "attribution": {
    "sourceSystem": "Bulma",
    "sourceOrganization": "Jeremy Thomas / Bulma community",
    "sourceUrl": "https://raw.githubusercontent.com/jgthms/bulma/main/sass/utilities/initial-variables.scss",
    "sourceLicense": "MIT",
    "harvestedAt": "2026-05-17",
    "harvestNotes": "Bulma initial-variables.scss extracted byte-faithfully. Turquoise primary + greyscale ramp. Hex source converted to OKLCH via culori. Extraction method: A. Mapping: Bulma's neutral ramp uses semantic stops (lighter/light/grey/dark/darker) rather than numeric. Status colours map: critical = red, success = green, warning = yellow, info = cyan; accent = turquoise.",
    "fidelityTier": "B",
    "sourceCommit": "main"
  },
  "status": "pending-3.5c-fill"
}
