{
  "$schema": "https://harrow.haus/quoin/schema/pack.json",
  "name": "@quoin/tokens-clarity",
  "version": "0.1.0",
  "type": "token",
  "quoinVersion": "^0.1.0",
  "description": "VMware Clarity palette translated onto the Quoin canonical semantic-token namespace.",
  "exports": {
    "tokens": "./tokens/index.json",
    "css": "./tokens.css"
  },
  "metadata": {
    "author": "Quoin",
    "license": "MIT",
    "homepage": "https://harrow.haus/quoin/packs/tokens-clarity",
    "tags": [
      "clarity",
      "vmware",
      "blue",
      "enterprise"
    ]
  },
  "attribution": {
    "sourceSystem": "Clarity Design System",
    "sourceOrganization": "VMware",
    "sourceUrl": "https://github.com/vmware-clarity/core",
    "sourceLicense": "MIT",
    "harvestedAt": "2026-05-17",
    "harvestNotes": "Clarity v6 light theme. Clarity's 'action blue' (#0072A3 area) is the brand accent. Heavy-blue, enterprise-IT aesthetic — gradients of teal/cobalt across the chrome.\n\nPhase 3.5b fidelity status: Tier C. Clarity tokens are auto-generated at build time by an internal pipeline; the published source tree does not include the static token file the build emits. The npm package @clr/core MIT does not expose tokens as JS exports either. Designed-approximation values stand pending VMware publishing the canonical token output.",
    "fidelityTier": "C",
    "sourceCommit": "main"
  }
}
