{
  "$schema": "https://harrow.haus/quoin/schema/pack.json",
  "name": "@quoin/tokens-govuk",
  "version": "0.1.0",
  "type": "token",
  "quoinVersion": "^0.1.0",
  "description": "GOV.UK Design System palette translated onto the Quoin canonical semantic-token namespace.",
  "exports": {
    "tokens": "./tokens/index.json",
    "css": "./tokens.css"
  },
  "metadata": {
    "author": "Quoin",
    "license": "MIT",
    "homepage": "https://harrow.haus/quoin/packs/tokens-govuk",
    "tags": [
      "govuk",
      "government",
      "uk",
      "accessibility",
      "transport-font"
    ]
  },
  "attribution": {
    "sourceSystem": "GOV.UK Design System",
    "sourceOrganization": "UK Government Digital Service",
    "sourceUrl": "https://design-system.service.gov.uk/",
    "sourceLicense": "MIT",
    "harvestedAt": "2026-05-16",
    "harvestNotes": "GOV.UK ships govuk-frontend under MIT. Colour palette: govuk-blue (#1d70b8) primary, govuk-black text on govuk-light-grey surface. GDS Transport typeface is proprietary to GDS; referenced by family name only with a system fallback.\n\nPhase 3.5 fidelity status: Tier C. The shipped OKLCH values are designed approximations informed by the source system's published palette structure and contrast pattern, not byte-faithful extraction. Canonical source extraction is deferred to a Phase 3.5b follow-up. See 03_harvest/fidelity/specs/ for the extraction framework; the upstream URL declared above is the verification target.",
    "fidelityTier": "C"
  }
}
