{
  "$schema": "https://harrow.haus/quoin/schema/pack.json",
  "name": "@quoin/vocab-radix",
  "version": "0.1.0",
  "type": "vocabulary",
  "quoinVersion": "^0.1.0",
  "description": "Radix UI-flavoured accessibility primitives — toggle, switch, slider, progress bar, dialog overlay.",
  "exports": {
    "primitives": "./primitives/index.json"
  },
  "metadata": {
    "author": "Quoin",
    "license": "MIT",
    "homepage": "https://harrow.haus/quoin/packs/vocab-radix",
    "tags": [
      "radix",
      "accessibility",
      "primitives",
      "headless"
    ]
  },
  "attribution": {
    "sourceSystem": "Radix UI",
    "sourceOrganization": "WorkOS",
    "sourceUrl": "https://www.radix-ui.com/primitives",
    "sourceLicense": "MIT",
    "harvestedAt": "2026-05-16",
    "harvestNotes": "Distills Radix UI's accessibility-first primitive set into Quoin semantic elements. Naming follows the role rather than Radix's component name (e.g. <accessible-toggle> instead of <Toggle.Root>). Use alongside the v1 vocab packs."
  }
}
