{
  "$schema": "https://harrow.haus/quoin/schema/pack.json",
  "name": "@quoin/tokens-workday",
  "version": "0.1.0",
  "type": "token",
  "quoinVersion": "^0.1.0",
  "description": "Workday Canvas Kit palette translated onto the Quoin canonical semantic-token namespace.",
  "exports": {
    "tokens": "./tokens/index.json",
    "css": "./tokens.css"
  },
  "metadata": {
    "author": "Quoin",
    "license": "Apache-2.0",
    "homepage": "https://harrow.haus/quoin/packs/tokens-workday",
    "tags": [
      "workday",
      "canvas-kit",
      "blue-accent",
      "hr"
    ]
  },
  "attribution": {
    "sourceSystem": "Workday Canvas Kit",
    "sourceOrganization": "Workday",
    "sourceUrl": "https://canvas.workday.com/",
    "sourceLicense": "Apache-2.0",
    "harvestedAt": "2026-05-16",
    "harvestNotes": "Canvas Kit v9 'main' light theme. Workday's brand blue (a teal-leaning navy) is the accent. Roboto typeface is open-source.\n\nPhase 3.5 fidelity status: Tier C. The shipped OKLCH values are designed approximations informed by the source system's published palette structure and contrast pattern, not byte-faithful extraction. Canonical source extraction is deferred to a Phase 3.5b follow-up. See 03_harvest/fidelity/specs/ for the extraction framework; the upstream URL declared above is the verification target.",
    "fidelityTier": "C"
  }
}
