{
  "$schema": "https://harrow.haus/quoin/schema/pack.json",
  "name": "@quoin/tokens-heroui",
  "version": "0.1.0",
  "type": "token",
  "quoinVersion": "^0.1.0",
  "description": "HeroUI (formerly NextUI) default palette translated onto the Quoin canonical semantic-token namespace.",
  "exports": {
    "tokens": "./tokens/index.json",
    "css": "./tokens.css"
  },
  "metadata": {
    "author": "Quoin",
    "license": "MIT",
    "homepage": "https://harrow.haus/quoin/packs/tokens-heroui",
    "tags": [
      "heroui",
      "nextui",
      "purple-accent",
      "react"
    ]
  },
  "attribution": {
    "sourceSystem": "HeroUI",
    "sourceOrganization": "HeroUI community",
    "sourceUrl": "https://www.heroui.com/",
    "sourceLicense": "MIT",
    "harvestedAt": "2026-05-16",
    "harvestNotes": "HeroUI (renamed from NextUI v2). Built on Tailwind v4 + React Aria. Default primary is a vibrant purple/blue accent. Inter typeface is open-source."
  }
}
