{
  "$schema": "https://harrow.haus/quoin/schema/pack.json",
  "name": "@quoin/tokens-tailwind",
  "version": "0.1.0",
  "type": "token",
  "quoinVersion": "^0.1.0",
  "description": "Tailwind v4 default palette and scales (zinc neutral), translated onto the Quoin canonical semantic-token namespace.",
  "exports": {
    "tokens": "./tokens/index.json",
    "css": "./tokens.css"
  },
  "metadata": {
    "author": "Quoin",
    "license": "MIT",
    "homepage": "https://harrow.haus/quoin/packs/tokens-tailwind",
    "tags": [
      "tailwind",
      "zinc",
      "oklch",
      "utility-first"
    ]
  },
  "attribution": {
    "sourceSystem": "Tailwind CSS",
    "sourceOrganization": "Tailwind Labs",
    "sourceUrl": "https://raw.githubusercontent.com/tailwindlabs/tailwindcss/main/packages/tailwindcss/theme.css",
    "sourceLicense": "MIT",
    "harvestedAt": "2026-05-17",
    "harvestNotes": "Default v4 palette extracted byte-faithfully from packages/tailwindcss/theme.css. Tailwind v4 ships native OKLCH; values preserved verbatim. Neutral ramp = zinc.",
    "sourceCommit": "main",
    "fidelityTier": "A"
  }
}
