{
  "$schema": "https://harrow.haus/quoin/schema/pack.json",
  "name": "@quoin/tokens-geist",
  "version": "0.1.0",
  "type": "token",
  "quoinVersion": "^0.1.0",
  "description": "Vercel Geist design language tokens translated onto the Quoin canonical semantic-token namespace.",
  "exports": {
    "tokens": "./tokens/index.json",
    "css": "./tokens.css"
  },
  "metadata": {
    "author": "Quoin",
    "license": "MIT",
    "homepage": "https://harrow.haus/quoin/packs/tokens-geist",
    "tags": [
      "geist",
      "vercel",
      "monochrome",
      "developer-tools"
    ]
  },
  "attribution": {
    "sourceSystem": "Geist Design Language",
    "sourceOrganization": "Vercel",
    "sourceUrl": "https://vercel.com/geist",
    "sourceLicense": "MIT",
    "harvestedAt": "2026-05-16",
    "harvestNotes": "Geist is published as @vercel/geist-ui in earlier form and as the Vercel design system more recently. Highly monochrome — almost pure white surfaces and near-black text. Geist Sans / Geist Mono are open-source via Vercel under SIL OFL; referenced by family name."
  }
}
