{
  "$schema": "https://harrow.haus/quoin/schema/pack.json",
  "name": "@quoin/vocab-editorial",
  "version": "0.1.0",
  "type": "vocabulary",
  "quoinVersion": "^0.1.0",
  "description": "Editorial primitives plus supporting layout and content primitives for long-form reading.",
  "exports": {
    "primitives": "./primitives/index.json"
  },
  "metadata": {
    "author": "Quoin",
    "license": "MIT",
    "homepage": "https://harrow.haus/quoin/packs/vocab-editorial",
    "tags": ["editorial", "long-form", "documentation", "essay", "swiss"]
  }
}
