{
  "$schema": "https://harrow.haus/quoin/schema/pack.json",
  "name": "@quoin/tokens-lightning",
  "version": "0.1.0",
  "type": "token",
  "quoinVersion": "^0.1.0",
  "description": "Salesforce Lightning Design System palette translated onto the Quoin canonical semantic-token namespace.",
  "exports": {
    "tokens": "./tokens/index.json",
    "css": "./tokens.css"
  },
  "metadata": {
    "author": "Quoin",
    "license": "BSD-3-Clause",
    "homepage": "https://harrow.haus/quoin/packs/tokens-lightning",
    "tags": [
      "lightning",
      "salesforce",
      "blue-accent",
      "enterprise"
    ]
  },
  "attribution": {
    "sourceSystem": "Lightning Design System (SLDS)",
    "sourceOrganization": "Salesforce",
    "sourceUrl": "https://raw.githubusercontent.com/salesforce-ux/design-system/main/design-tokens/aliases/color-palettes.yml",
    "sourceLicense": "BSD-3-Clause",
    "harvestedAt": "2026-05-17",
    "harvestNotes": "Salesforce SLDS palette extracted from salesforce-ux/design-system design-tokens/aliases/color-palettes.yml. Extraction method: A. Mapping: SLDS cool-gray + warm-gray + blue/green/red/orange/yellow ramps (steps 1-13). Default accent = BLUE_4 (Salesforce brand).",
    "fidelityTier": "B",
    "sourceCommit": "main"
  },
  "status": "pending-3.5c-fill"
}
