{
  "$schema": "https://harrow.haus/quoin/schema/pack.json",
  "name": "@quoin/tokens-material3",
  "version": "0.1.0",
  "type": "token",
  "quoinVersion": "^0.1.0",
  "description": "Material Design 3 (M3) baseline palette translated onto the Quoin canonical semantic-token namespace.",
  "exports": {
    "tokens": "./tokens/index.json",
    "css": "./tokens.css"
  },
  "metadata": {
    "author": "Quoin",
    "license": "Apache-2.0",
    "homepage": "https://harrow.haus/quoin/packs/tokens-material3",
    "tags": [
      "material",
      "material-3",
      "google",
      "purple-accent"
    ]
  },
  "attribution": {
    "sourceSystem": "Material Design 3",
    "sourceOrganization": "Google",
    "sourceUrl": "https://m3.material.io/",
    "sourceLicense": "Apache-2.0",
    "harvestedAt": "2026-05-17",
    "harvestNotes": "Values computed by running @material/material-color-utilities with M3's documented baseline seed (#6750A4). 13 tones × 6 role palettes (primary, secondary, tertiary, neutral, neutral variant, error). To regenerate with a different seed: install the library, change SEED in fidelity/specs/material3.js, and re-run. Extraction method: B. Algorithm: @material/material-color-utilities@0.2.7, inputs {\"seed\":\"#6750A4\",\"status\":{\"success\":\"#43A047\",\"warning\":\"#FFA000\",\"info\":\"#1976D2\"},\"tones\":[0,10,20,30,40,50,60,70,80,90,95,99,100]}. Mapping: M3 13-tone scale per role palette. Light-theme mapping: surface = neutral.98, surface-elevated = neutral.99, surface-recessed = neutral.95, surface-inverse = neutral.20, text = neutral.20, text-emphasis = neutral.10, accent = primary.40, accent-recede = primary.90, critical = error.40.",
    "fidelityTier": "B",
    "sourceCommit": "0.2.7"
  }
}
